{
  "urgency": "URGENT",
  "obligation_id": "0192f3a1-7b2c-7d4e-8f90-300000000001",
  "obligation_version": 0,
  "request_id": "0192f3a1-7b2c-7d4e-8f90-200000000001",
  "origin": "DOCTOR_CHOICE",
  "source_clinic_id": 1,
  "target_clinic_id": 2,
  "component_kind": "RBC",
  "requested_qty": 3,
  "deadline": "2026-10-23T10:15:00Z"
}
